{
  "Loggers": [
    {
      "Name": "IPersonActorLogger",
      "StartId": 100,
      "ImplicitArguments": [
        {
          "Name": "actor",
          "Type": "Actor"
        },
        {
          "Name": "context",
          "Type": "ServiceRequestContext"
        }
      ],
      "OverrideArguments": []
    },
    {
      "Name": "IPersonActorServiceLogger",
      "StartId": 200,
      "ImplicitArguments": [
        {
          "Name": "actorService",
          "Type": "ActorService"
        },
        {
          "Name": "context",
          "Type": "ServiceRequestContext"
        }
      ],
      "OverrideArguments": []
    },
    {
      "Name": "IServicesCommunicationLogger",
      "StartId": 1000,
      "ImplicitArguments": [
        {
          "Name": "context",
          "Type": "StatefulServiceContext"
        }
      ],
      "OverrideArguments": [
      ]
    }
  ],
  "Name": "PersonActorServiceEventSource",
  "ProviderName": "CodeEffect-ServiceFabric-Auditing-PersonActorService",
  "Keywords": [],
  "TypeTemplates": [
    {
      "Name": "ServiceRequestContext",
      "CLRType": "CodeEffect.ServiceFabric.Services.Remoting.FabricTransport.ServiceRequestContext",
      "Arguments": [
        {
          "Assignment": "CodeEffect.ServiceFabric.Services.Remoting.FabricTransport.ServiceRequestContext.Current?[\"correlationId\"]",
          "Name": "correlationId",
          "Type": "string"
        },
        {
          "Assignment": "CodeEffect.ServiceFabric.Services.Remoting.FabricTransport.ServiceRequestContext.Current?[\"userId\"]",
          "Name": "userId",
          "Type": "string"
        },
        {
          "Assignment": "CodeEffect.ServiceFabric.Services.Remoting.FabricTransport.ServiceRequestContext.Current?[\"requestId\"]",
          "Name": "requestId",
          "Type": "string"
        }
      ]
    }
  ],
  "Settings": {
    "AutogenerateLoggerInterfaces": false
  }
}