{
  "Loggers": [
    {
      "Name": "ITitleServiceLogger",
      "StartId": 200,
      "ImplicitArguments": [
        {
          "Name": "serviceContext",
          "Type": "StatefulServiceContext"
        },
        {
          "Name": "requestContext",
          "Type": "ServiceRequestContext"
        }
      ],
      "OverrideArguments": []
    },
    {
      "Name": "ICommunicationLogger",
      "StartId": 1000,
      "ImplicitArguments": [
        {
          "Name": "context",
          "Type": "StatefulServiceContext"
        }
      ],
      "OverrideArguments": [
      ]
    }
  ],
  "Name": "TitleServiceEventSource",
  "ProviderName": "CodeEffect-ServiceFabric-Auditing-TitleService",
  "Keywords": [],
  "TypeTemplates": [],
  "Settings": {
    "AutogenerateLoggerInterfaces": false,
    "Modules": [ "ServiceFabric", "AI" ]
  }
}