{
  "Loggers": [],
  "Name": "DefaultEventSource",
  "ProviderName": "CodeEffect-ServiceFabric-Actors-FabricTransport-Diagnostics-Default",
  "Keywords": [],
  "TypeTemplates": [
    {
      "Name": "Exception",
      "CLRType": "System.Exception",
      "Arguments": [
        {
          "Name": "message",
          "Type": "string",
          "Assignment": "$this.Message"
        },
        {
          "Name": "source",
          "Type": "string",
          "Assignment": "$this.Source"
        },
        {
          "Name": "exceptionTypeName",
          "Type": "string",
          "Assignment": "$this.GetType().FullName"
        },
        {
          "Name": "exception",
          "Type": "string",
          "Assignment": "$this.AsJson()"
        }
      ]
    }
  ],
  "Settings": {
    "AutogenerateLoggerInterfaces": false
  }
}